Query_ID,Accession,Name,Description,Library,Library Release,Start_End
OFBKKLGO_01858_pyrP,TIGR00801,TIGR00801,ncs2: uracil-xanthine permease,TIGRFAM,15.0,16-418
OFBKKLGO_01862_rluD_2,TIGR00005,TIGR00005,"rluA_subfam: pseudouridine synthase, RluA family",TIGRFAM,15.0,11-301
OFBKKLGO_01863_lspA,TIGR00077,TIGR00077,lspA: signal peptidase II,TIGRFAM,15.0,2-152
OFBKKLGO_01866_divIVA,TIGR03544,TIGR03544,DivI1A_domain: DivIVA domain,TIGRFAM,15.0,3-36
OFBKKLGO_01870_yggS,TIGR00044,TIGR00044,"TIGR00044: pyridoxal phosphate enzyme, YggS family",TIGRFAM,15.0,6-223
OFBKKLGO_01871_group_2823,TIGR00726,TIGR00726,TIGR00726: YfiH family protein,TIGRFAM,15.0,40-276
OFBKKLGO_01872_ylmC,TIGR02888,TIGR02888,"spore_YlmC_YmxH: sporulation protein, YlmC/YmxH family",TIGRFAM,15.0,4-75
OFBKKLGO_01876_sigG,TIGR02937,TIGR02937,"sigma70-ECF: RNA polymerase sigma factor, sigma-70 family",TIGRFAM,15.0,38-257
OFBKKLGO_01876_sigG,TIGR02850,TIGR02850,spore_sigG: RNA polymerase sigma-G factor,TIGRFAM,15.0,4-258
OFBKKLGO_01876_sigG,TIGR02980,TIGR02980,"SigBFG: RNA polymerase sigma-70 factor, sigma-B/F/G subfamily",TIGRFAM,15.0,37-258
OFBKKLGO_01877_sigE,TIGR02937,TIGR02937,"sigma70-ECF: RNA polymerase sigma factor, sigma-70 family",TIGRFAM,15.0,58-234
OFBKKLGO_01877_sigE,TIGR02835,TIGR02835,spore_sigmaE: RNA polymerase sigma-E factor,TIGRFAM,15.0,8-239
OFBKKLGO_01878_spoIIGA,TIGR02854,TIGR02854,spore_II_GA: sigma-E processing peptidase SpoIIGA,TIGRFAM,15.0,2-300
OFBKKLGO_01881_ftsA,TIGR01174,TIGR01174,ftsA: cell division protein FtsA,TIGRFAM,15.0,7-369
OFBKKLGO_01883_murB,TIGR00179,TIGR00179,murB: UDP-N-acetylenolpyruvoylglucosamine reductase,TIGRFAM,15.0,22-300
OFBKKLGO_01884_murG_1,TIGR01133,TIGR01133,murG: undecaprenyldiphospho-muramoylpentapeptide beta-N-acetylglucosaminyltransferase,TIGRFAM,15.0,1-357
OFBKKLGO_01885_ftsW_2,TIGR02614,TIGR02614,ftsW: cell division protein FtsW,TIGRFAM,15.0,1-338
OFBKKLGO_01885_ftsW_2,TIGR02615,TIGR02615,spoVE: stage V sporulation protein E,TIGRFAM,15.0,1-337
OFBKKLGO_01886_murD,TIGR01087,TIGR01087,murD: UDP-N-acetylmuramoylalanine--D-glutamate ligase,TIGRFAM,15.0,11-448
OFBKKLGO_01887_mraY,TIGR00445,TIGR00445,mraY: phospho-N-acetylmuramoyl-pentapeptide-transferase,TIGRFAM,15.0,17-323
OFBKKLGO_01888_murE,TIGR01085,TIGR01085,murE: UDP-N-acetylmuramyl-tripeptide synthetase,TIGRFAM,15.0,22-484
OFBKKLGO_01889_spoVD,TIGR02214,TIGR02214,spoVD_pbp: stage V sporulation protein D,TIGRFAM,15.0,11-637
OFBKKLGO_01891_ftsL,TIGR02209,TIGR02209,ftsL_broad: cell division protein FtsL,TIGRFAM,15.0,34-116
OFBKKLGO_01892_rsmH_1,TIGR00006,TIGR00006,TIGR00006: 16S rRNA (cytosine(1402)-N(4))-methyltransferase,TIGRFAM,15.0,2-309
OFBKKLGO_01893_mraZ,TIGR00242,TIGR00242,TIGR00242: division/cell wall cluster transcriptional repressor MraZ,TIGRFAM,15.0,12-154
OFBKKLGO_01894_bshC,TIGR03998,TIGR03998,thiol_BshC: bacillithiol biosynthesis cysteine-adding enzyme BshC,TIGRFAM,15.0,30-556
OFBKKLGO_01897_rsfA_1,TIGR02894,TIGR02894,"DNA_bind_RsfA: transcription factor, RsfA family",TIGRFAM,15.0,4-78
OFBKKLGO_01898_rpmF,TIGR01031,TIGR01031,rpmF_bact: ribosomal protein bL32,TIGRFAM,15.0,2-54
OFBKKLGO_01903_ylbJ,TIGR02871,TIGR02871,spore_ylbJ: sporulation integral membrane protein YlbJ,TIGRFAM,15.0,10-390
OFBKKLGO_01904_coaD,TIGR01510,TIGR01510,coaD_prev_kdtB: pantetheine-phosphate adenylyltransferase,TIGRFAM,15.0,4-158
OFBKKLGO_01904_coaD,TIGR00125,TIGR00125,cyt_tran_rel: cytidyltransferase-like domain,TIGRFAM,15.0,4-64
OFBKKLGO_01905_rsmD,TIGR00095,TIGR00095,TIGR00095: 16S rRNA (guanine(966)-N(2))-methyltransferase RsmD,TIGRFAM,15.0,2-181
OFBKKLGO_01914_group_4694,TIGR02737,TIGR02737,caa3_CtaG: cytochrome c oxidase assembly factor CtaG,TIGRFAM,15.0,3-277
OFBKKLGO_01915_caaD,TIGR02908,TIGR02908,"CoxD_Bacillus: cytochrome c oxidase, subunit IVB",TIGRFAM,15.0,1-110
OFBKKLGO_01917_ctaD,TIGR02891,TIGR02891,"CtaD_CoxA: cytochrome c oxidase, subunit I",TIGRFAM,15.0,18-521
OFBKKLGO_01918_ctaC,TIGR02866,TIGR02866,"CoxB: cytochrome c oxidase, subunit II",TIGRFAM,15.0,31-244
OFBKKLGO_01919_ctaB2,TIGR01473,TIGR01473,cyoE_ctaB: protoheme IX farnesyltransferase,TIGRFAM,15.0,23-301
OFBKKLGO_01921_pycA,TIGR01235,TIGR01235,pyruv_carbox: pyruvate carboxylase,TIGRFAM,15.0,8-1146
OFBKKLGO_01924_glsA2,TIGR03814,TIGR03814,Gln_ase: glutaminase A,TIGRFAM,15.0,9-309
OFBKKLGO_01927_group_3650,TIGR02898,TIGR02898,"spore_YhcN_YlaJ: sporulation lipoprotein, YhcN/YlaJ family",TIGRFAM,15.0,3-161
OFBKKLGO_01930_typA,TIGR01394,TIGR01394,TypA_BipA: GTP-binding protein TypA/BipA,TIGRFAM,15.0,7-601
OFBKKLGO_01930_typA,TIGR00231,TIGR00231,small_GTP: small GTP-binding protein domain,TIGRFAM,15.0,8-146
OFBKKLGO_01951_defB,TIGR00079,TIGR00079,pept_deformyl: peptide deformylase,TIGRFAM,15.0,4-180
OFBKKLGO_01954_rnjA,TIGR00649,TIGR00649,"MG423: beta-CASP ribonuclease, RNase J family",TIGRFAM,15.0,10-553
OFBKKLGO_01955_adeC,TIGR01178,TIGR01178,ade: adenine deaminase,TIGRFAM,15.0,20-575
OFBKKLGO_01958_sasA_1,TIGR00229,TIGR00229,sensory_box: PAS domain S-box protein,TIGRFAM,15.0,82-198
OFBKKLGO_01963_group_735,TIGR00745,TIGR00745,apbA_panE: 2-dehydropantoate 2-reductase,TIGRFAM,15.0,2-301
OFBKKLGO_01966_sipT,TIGR02227,TIGR02227,sigpep_I_bact: signal peptidase I,TIGRFAM,15.0,25-186
OFBKKLGO_01967_fruA,TIGR00829,TIGR00829,"FRU: PTS system, Fru family, IIB component",TIGRFAM,15.0,174-255
OFBKKLGO_01967_fruA,TIGR00848,TIGR00848,"fruA: PTS system, fructose subfamily, IIA component",TIGRFAM,15.0,6-133
OFBKKLGO_01967_fruA,TIGR01427,TIGR01427,"PTS_IIC_fructo: PTS system, Fru family, IIC component",TIGRFAM,15.0,299-628
OFBKKLGO_01968_lacC,TIGR03828,TIGR03828,pfkB: 1-phosphofructokinase,TIGRFAM,15.0,2-301
OFBKKLGO_01968_lacC,TIGR03168,TIGR03168,"1-PFK: hexose kinase, 1-phosphofructokinase family",TIGRFAM,15.0,2-301
OFBKKLGO_01977_moeA,TIGR00177,TIGR00177,molyb_syn: molybdenum cofactor synthesis domain,TIGRFAM,15.0,186-323
OFBKKLGO_01987_ykuR,TIGR01891,TIGR01891,amidohydrolases: amidohydrolase,TIGRFAM,15.0,6-361
OFBKKLGO_01988_dapH_1,TIGR03532,TIGR03532,"DapD_Ac: 2,3,4,5-tetrahydropyridine-2,6-dicarboxylate N-acetyltransferase",TIGRFAM,15.0,6-236
OFBKKLGO_01991_group_1798,TIGR01753,TIGR01753,flav_short: flavodoxin,TIGRFAM,15.0,5-143
OFBKKLGO_02003_group_4712,TIGR00900,TIGR00900,2A0121: H+ Antiporter protein,TIGRFAM,15.0,9-377
OFBKKLGO_02010_group_998,TIGR02909,TIGR02909,"spore_YkwD: uncharacterized protein, YkwD family",TIGRFAM,15.0,135-257
OFBKKLGO_02014_splB,TIGR04070,TIGR04070,photo_TT_lyase: spore photoproduct lyase,TIGRFAM,15.0,5-342
OFBKKLGO_02016_ptsI,TIGR01417,TIGR01417,PTS_I_fam: phosphoenolpyruvate-protein phosphotransferase,TIGRFAM,15.0,4-566
OFBKKLGO_02017_ptsH,TIGR01003,TIGR01003,"PTS_HPr_family: phosphocarrier, HPr family",TIGRFAM,15.0,1-81
OFBKKLGO_02018_ptsG,TIGR00826,TIGR00826,"EIIB_glc: PTS system, glucose-like IIB component",TIGRFAM,15.0,413-499
OFBKKLGO_02018_ptsG,TIGR00852,TIGR00852,"pts-Glc: PTS system, maltose and glucose-specific subfamily, IIC component",TIGRFAM,15.0,64-365
OFBKKLGO_02018_ptsG,TIGR00830,TIGR00830,"PTBA: PTS system, glucose subfamily, IIA component",TIGRFAM,15.0,552-671
OFBKKLGO_02018_ptsG,TIGR02002,TIGR02002,"PTS-II-BC-glcB: PTS system, glucose-specific IIBC component",TIGRFAM,15.0,2-515
OFBKKLGO_02022_zosA,TIGR01525,TIGR01525,ATPase-IB_hvy: heavy metal translocating P-type ATPase,TIGRFAM,15.0,84-635
OFBKKLGO_02022_zosA,TIGR01494,TIGR01494,"ATPase_P-type: HAD ATPase, P-type, family IC",TIGRFAM,15.0,107-612
OFBKKLGO_02030_queE_2,TIGR03365,TIGR03365,Bsubt_queE: 7-cyano-7-deazaguanosine (preQ0) biosynthesis protein QueE,TIGRFAM,15.0,4-243
OFBKKLGO_02031_queD,TIGR00039,TIGR00039,6PTHBS: 6-pyruvoyl tetrahydropterin synthase/QueD family protein,TIGRFAM,15.0,15-141
OFBKKLGO_02031_queD,TIGR03367,TIGR03367,queuosine_QueD: queuosine biosynthesis protein QueD,TIGRFAM,15.0,16-110
OFBKKLGO_02032_queC,TIGR00364,TIGR00364,TIGR00364: queuosine biosynthesis protein QueC,TIGRFAM,15.0,6-204
OFBKKLGO_02045_mtnX,TIGR01489,TIGR01489,"DKMTPPase-SF: 2,3-diketo-5-methylthio-1-phosphopentane phosphatase",TIGRFAM,15.0,5-187
OFBKKLGO_02045_mtnX,TIGR01488,TIGR01488,"HAD-SF-IB: HAD phosphoserine phosphatase-like hydrolase, family IB",TIGRFAM,15.0,6-179
OFBKKLGO_02045_mtnX,TIGR03333,TIGR03333,salvage_mtnX: 2-hydroxy-3-keto-5-methylthiopentenyl-1-phosphate phosphatase,TIGRFAM,15.0,6-219
OFBKKLGO_02046_mtnW,TIGR03332,TIGR03332,"salvage_mtnW: 2,3-diketo-5-methylthiopentyl-1-phosphate enolase",TIGRFAM,15.0,2-399
OFBKKLGO_02051_mtnK,TIGR01767,TIGR01767,MTRK: S-methyl-5-thioribose kinase,TIGRFAM,15.0,36-390
OFBKKLGO_02052_mtnA,TIGR00524,TIGR00524,eIF-2B_rel: eIF-2B alpha/beta/delta-related uncharacterized proteins,TIGRFAM,15.0,36-336
OFBKKLGO_02052_mtnA,TIGR00512,TIGR00512,salvage_mtnA: S-methyl-5-thioribose-1-phosphate isomerase,TIGRFAM,15.0,9-336
OFBKKLGO_02055_kinE,TIGR00229,TIGR00229,sensory_box: PAS domain S-box protein,TIGRFAM,15.0,272-389;390-509;31-147;151-269
OFBKKLGO_02065_group_4724,TIGR03716,TIGR03716,"R_switched_YkoY: integral membrane protein, YkoY family",TIGRFAM,15.0,12-243
OFBKKLGO_02068_ku,TIGR02772,TIGR02772,Ku_bact: Ku protein,TIGRFAM,15.0,1-257
OFBKKLGO_02075_mgtE,TIGR00400,TIGR00400,mgtE: magnesium transporter,TIGRFAM,15.0,4-450
OFBKKLGO_02086_metE_1,TIGR01371,TIGR01371,met_syn_B12ind: 5-methyltetrahydropteroyltriglutamate--homocysteine S-methyltransferase,TIGRFAM,15.0,9-757
OFBKKLGO_02093_ohrB,TIGR03561,TIGR03561,"organ_hyd_perox: peroxiredoxin, Ohr subfamily",TIGRFAM,15.0,3-134
OFBKKLGO_02095_ohrA,TIGR03561,TIGR03561,"organ_hyd_perox: peroxiredoxin, Ohr subfamily",TIGRFAM,15.0,5-137
OFBKKLGO_02096_proA,TIGR00407,TIGR00407,proA: glutamate-5-semialdehyde dehydrogenase,TIGRFAM,15.0,11-404
OFBKKLGO_02097_proB_1,TIGR01027,TIGR01027,proB: glutamate 5-kinase,TIGRFAM,15.0,4-361
OFBKKLGO_02098_purU,TIGR00655,TIGR00655,PurU: formyltetrahydrofolate deformylase,TIGRFAM,15.0,21-299
OFBKKLGO_02112_oppD_4,TIGR01727,TIGR01727,"oligo_HPY: oligopeptide/dipeptide ABC transporter, ATP-binding protein, C-terminal domain",TIGRFAM,15.0,234-320
OFBKKLGO_02128_group_1802,TIGR01592,TIGR01592,"holin_SPP1: holin, SPP1 family",TIGRFAM,15.0,5-84
OFBKKLGO_02182_fetB,TIGR00245,TIGR00245,TIGR00245: TIGR00245 family protein,TIGRFAM,15.0,1-246
OFBKKLGO_02305_group_2859,TIGR01439,TIGR01439,"lp_hng_hel_AbrB: transcriptional regulator, AbrB family",TIGRFAM,15.0,12-53
OFBKKLGO_02323_thiD,TIGR00097,TIGR00097,HMP-P_kinase: hydroxymethylpyrimidine kinase/phosphomethylpyrimidine kinase,TIGRFAM,15.0,6-260
OFBKKLGO_02326_thiS,TIGR01683,TIGR01683,thiS: thiamine biosynthesis protein ThiS,TIGRFAM,15.0,4-67
OFBKKLGO_02329_tenA,TIGR04306,TIGR04306,salvage_TenA: thiaminase II,TIGRFAM,15.0,11-215
OFBKKLGO_02343_pepF1_1,TIGR00181,TIGR00181,pepF: oligoendopeptidase F,TIGRFAM,15.0,13-601
OFBKKLGO_02346_group_3701,TIGR03717,TIGR03717,"R_switched_YjbE: integral membrane protein, YjbE family",TIGRFAM,15.0,9-181
OFBKKLGO_02347_spxA,TIGR01617,TIGR01617,"arsC_related: transcriptional regulator, Spx/MgsR family",TIGRFAM,15.0,3-114
OFBKKLGO_02351_oppD_3,TIGR01727,TIGR01727,"oligo_HPY: oligopeptide/dipeptide ABC transporter, ATP-binding protein, C-terminal domain",TIGRFAM,15.0,233-319
OFBKKLGO_02356_trpS,TIGR00233,TIGR00233,trpS: tryptophan--tRNA ligase,TIGRFAM,15.0,1-325
OFBKKLGO_02362_oppD_2,TIGR01727,TIGR01727,"oligo_HPY: oligopeptide/dipeptide ABC transporter, ATP-binding protein, C-terminal domain",TIGRFAM,15.0,233-319
OFBKKLGO_02364_fabF_2,TIGR03150,TIGR03150,fabF: beta-ketoacyl-acyl-carrier-protein synthase II,TIGRFAM,15.0,4-409
OFBKKLGO_02365_fabHA,TIGR00747,TIGR00747,fabH: 3-oxoacyl-[acyl-carrier-protein] synthase III,TIGRFAM,15.0,1-310
OFBKKLGO_02373_argF,TIGR00658,TIGR00658,orni_carb_tr: ornithine carbamoyltransferase,TIGRFAM,15.0,16-314
OFBKKLGO_02375_carA_1,TIGR01368,TIGR01368,"CPSaseIIsmall: carbamoyl-phosphate synthase, small subunit",TIGRFAM,15.0,4-342
OFBKKLGO_02376_argD,TIGR00707,TIGR00707,"argD: transaminase, acetylornithine/succinylornithine family",TIGRFAM,15.0,4-378
OFBKKLGO_02378_argJ,TIGR00120,TIGR00120,ArgJ: glutamate N-acetyltransferase/amino-acid acetyltransferase,TIGRFAM,15.0,11-405
OFBKKLGO_02379_argC,TIGR01850,TIGR01850,argC: N-acetyl-gamma-glutamyl-phosphate reductase,TIGRFAM,15.0,2-345
OFBKKLGO_02383_xerD,TIGR02224,TIGR02224,recomb_XerC: tyrosine recombinase XerC,TIGRFAM,15.0,6-296
OFBKKLGO_02383_xerD,TIGR02225,TIGR02225,recomb_XerD: tyrosine recombinase XerD,TIGRFAM,15.0,7-296
OFBKKLGO_02386_spoIIM,TIGR02831,TIGR02831,spo_II_M: stage II sporulation protein M,TIGRFAM,15.0,10-207
OFBKKLGO_02390_mleN,TIGR00931,TIGR00931,antiport_nhaC: Na+/H+ antiporter NhaC,TIGRFAM,15.0,5-458
OFBKKLGO_02391_aspA,TIGR00839,TIGR00839,aspA: aspartate ammonia-lyase,TIGRFAM,15.0,9-472
OFBKKLGO_02394_group_2875,TIGR00375,TIGR00375,TIGR00375: TIGR00375 family protein,TIGRFAM,15.0,27-385
OFBKKLGO_02410_coaA,TIGR00554,TIGR00554,panK_bact: pantothenate kinase,TIGRFAM,15.0,11-318
OFBKKLGO_02414_proC_2,TIGR00112,TIGR00112,proC: pyrroline-5-carboxylate reductase,TIGRFAM,15.0,4-265
OFBKKLGO_02420_rnz,TIGR02651,TIGR02651,RNase_Z: ribonuclease Z,TIGRFAM,15.0,2-304
OFBKKLGO_02421_zwf,TIGR00871,TIGR00871,zwf: glucose-6-phosphate dehydrogenase,TIGRFAM,15.0,8-488
OFBKKLGO_02422_gndA,TIGR00873,TIGR00873,gnd: 6-phosphogluconate dehydrogenase (decarboxylating),TIGRFAM,15.0,5-468
OFBKKLGO_02425_misCB,TIGR03592,TIGR03592,"yidC_oxa1_cterm: membrane protein insertase, YidC/Oxa1 family",TIGRFAM,15.0,65-260
OFBKKLGO_02429_epi,TIGR03081,TIGR03081,metmalonyl_epim: methylmalonyl-CoA epimerase,TIGRFAM,15.0,3-130
OFBKKLGO_02434_artQ,TIGR01726,TIGR01726,"HEQRo_perm_3TM: amino ABC transporter, permease protein, 3-TM region, His/Glu/Gln/Arg/opine family",TIGRFAM,15.0,12-110
OFBKKLGO_02436_group_15853,TIGR04191,TIGR04191,"YphP_YqiW: putative bacilliredoxin, YphP/YqiW family",TIGRFAM,15.0,8-142
OFBKKLGO_02437_bmrU,TIGR00147,TIGR00147,"TIGR00147: lipid kinase, YegS/Rv2252/BmrU family",TIGRFAM,15.0,4-294
OFBKKLGO_02441_lpd,TIGR01350,TIGR01350,lipoamide_DH: dihydrolipoyl dehydrogenase,TIGRFAM,15.0,4-473
OFBKKLGO_02442_buk2,TIGR02707,TIGR02707,butyr_kinase: butyrate kinase,TIGRFAM,15.0,7-357
OFBKKLGO_02444_pta_1,TIGR02706,TIGR02706,P_butyryltrans: phosphate butyryltransferase,TIGRFAM,15.0,4-294
OFBKKLGO_02445_norR_2,TIGR00229,TIGR00229,sensory_box: PAS domain S-box protein,TIGRFAM,15.0,119-227;235-349
OFBKKLGO_02452_mmgA,TIGR01930,TIGR01930,AcCoA-C-Actrans: acetyl-CoA C-acyltransferase,TIGRFAM,15.0,6-391
OFBKKLGO_02467_argR,TIGR01529,TIGR01529,argR_whole: arginine repressor,TIGRFAM,15.0,5-149
OFBKKLGO_02468_tlyA,TIGR00478,TIGR00478,tly: TlyA family rRNA methyltransferase/putative hemolysin,TIGRFAM,15.0,7-239
OFBKKLGO_02471_xseB,TIGR01280,TIGR01280,"xseB: exodeoxyribonuclease VII, small subunit",TIGRFAM,15.0,11-66
OFBKKLGO_02472_xseA,TIGR00237,TIGR00237,"xseA: exodeoxyribonuclease VII, large subunit",TIGRFAM,15.0,8-358
OFBKKLGO_02474_nusB,TIGR01951,TIGR01951,nusB: transcription antitermination factor NusB,TIGRFAM,15.0,2-127
OFBKKLGO_02476_accC,TIGR00514,TIGR00514,"accC: acetyl-CoA carboxylase, biotin carboxylase subunit",TIGRFAM,15.0,1-449
OFBKKLGO_02477_accB,TIGR00531,TIGR00531,"BCCP: acetyl-CoA carboxylase, biotin carboxyl carrier protein",TIGRFAM,15.0,2-157
OFBKKLGO_02479_group_2887,TIGR02830,TIGR02830,spore_III_AG: stage III sporulation protein AG,TIGRFAM,15.0,29-225
OFBKKLGO_02481_spoIIIAE,TIGR02829,TIGR02829,spore_III_AE: stage III sporulation protein AE,TIGRFAM,15.0,1-395
OFBKKLGO_02482_group_6271,TIGR02849,TIGR02849,spore_III_AD: stage III sporulation protein AD,TIGRFAM,15.0,2-98
OFBKKLGO_02483_group_16176,TIGR02848,TIGR02848,spore_III_AC: stage III sporulation protein AC,TIGRFAM,15.0,3-66
OFBKKLGO_02484_spoIIIAB,TIGR02833,TIGR02833,spore_III_AB: stage III sporulation protein AB,TIGRFAM,15.0,3-171
OFBKKLGO_02485_group_6272,TIGR02858,TIGR02858,spore_III_AA: stage III sporulation protein AA,TIGRFAM,15.0,28-291
OFBKKLGO_02487_efp,TIGR00038,TIGR00038,efp: translation elongation factor P,TIGRFAM,15.0,2-185
OFBKKLGO_02504_tasA,TIGR04088,TIGR04088,cognate_SipW: SipW-cognate class signal peptide,TIGRFAM,15.0,11-44
OFBKKLGO_02512_group_880,TIGR02532,TIGR02532,IV_pilin_GFxxxE: prepilin-type N-terminal cleavage/methylation domain,TIGRFAM,15.0,9-30
OFBKKLGO_02513_comGC,TIGR02532,TIGR02532,IV_pilin_GFxxxE: prepilin-type N-terminal cleavage/methylation domain,TIGRFAM,15.0,7-30
OFBKKLGO_02519_mgsR_1,TIGR01617,TIGR01617,"arsC_related: transcriptional regulator, Spx/MgsR family",TIGRFAM,15.0,5-115
OFBKKLGO_02523_group_6284,TIGR00106,TIGR00106,"TIGR00106: uncharacterized protein, MTH1187 family",TIGRFAM,15.0,2-101
OFBKKLGO_02527_glcK,TIGR00744,TIGR00744,ROK_glcA_fam: ROK family protein (putative glucokinase),TIGRFAM,15.0,7-320
OFBKKLGO_02529_nhaC_2,TIGR00931,TIGR00931,antiport_nhaC: Na+/H+ antiporter NhaC,TIGRFAM,15.0,2-416
OFBKKLGO_02532_rpmGA,TIGR01023,TIGR01023,rpmG_bact: ribosomal protein bL33,TIGRFAM,15.0,3-49
OFBKKLGO_02535_pstB3_2,TIGR00972,TIGR00972,"3a0107s01c2: phosphate ABC transporter, ATP-binding protein",TIGRFAM,15.0,14-260
OFBKKLGO_02536_pstB3_3,TIGR00972,TIGR00972,"3a0107s01c2: phosphate ABC transporter, ATP-binding protein",TIGRFAM,15.0,22-268
OFBKKLGO_02537_pstA,TIGR00974,TIGR00974,"3a0107s02c: phosphate ABC transporter, permease protein PstA",TIGRFAM,15.0,8-286
OFBKKLGO_02538_pstC,TIGR02138,TIGR02138,"phosphate_pstC: phosphate ABC transporter, permease protein PstC",TIGRFAM,15.0,29-307
OFBKKLGO_02539_pstS1,TIGR02136,TIGR02136,ptsS_2: phosphate binding protein,TIGRFAM,15.0,4-286
OFBKKLGO_02546_ispG,TIGR00612,TIGR00612,ispG_gcpE: 4-hydroxy-3-methylbut-2-en-1-yl diphosphate synthase,TIGRFAM,15.0,7-350
OFBKKLGO_02555_ispH,TIGR00216,TIGR00216,ispH_lytB: 4-hydroxy-3-methylbut-2-enyl diphosphate reductase,TIGRFAM,15.0,3-286
OFBKKLGO_02556_group_2897,TIGR00486,TIGR00486,"YbgI_SA1388: dinuclear metal center protein, YbgI/SA1388 family",TIGRFAM,15.0,5-369
OFBKKLGO_02559_sigA,TIGR02937,TIGR02937,"sigma70-ECF: RNA polymerase sigma factor, sigma-70 family",TIGRFAM,15.0,138-361
OFBKKLGO_02559_sigA,TIGR02393,TIGR02393,RpoD_Cterm: RNA polymerase sigma factor RpoD,TIGRFAM,15.0,137-372
OFBKKLGO_02560_dnaG,TIGR01391,TIGR01391,dnaG: DNA primase,TIGRFAM,15.0,4-420
OFBKKLGO_02564_glyS,TIGR00211,TIGR00211,"glyS: glycine--tRNA ligase, beta subunit",TIGRFAM,15.0,1-676
OFBKKLGO_02565_glyQ,TIGR00388,TIGR00388,"glyQ: glycine--tRNA ligase, alpha subunit",TIGRFAM,15.0,1-288
OFBKKLGO_02566_recO,TIGR00613,TIGR00613,reco: DNA repair protein RecO,TIGRFAM,15.0,3-243
OFBKKLGO_02568_era,TIGR00231,TIGR00231,small_GTP: small GTP-binding protein domain,TIGRFAM,15.0,9-169
OFBKKLGO_02568_era,TIGR00436,TIGR00436,era: GTP-binding protein Era,TIGRFAM,15.0,9-279
OFBKKLGO_02569_cdd,TIGR01354,TIGR01354,cyt_deam_tetra: cytidine deaminase,TIGRFAM,15.0,5-129
OFBKKLGO_02571_ybeY,TIGR00043,TIGR00043,TIGR00043: rRNA maturation RNase YbeY,TIGRFAM,15.0,40-153
OFBKKLGO_02572_pgpH,TIGR00277,TIGR00277,HDIG: HDIG domain,TIGRFAM,15.0,497-595
OFBKKLGO_02575_group_15757,TIGR02856,TIGR02856,spore_yqfC: sporulation protein YqfC,TIGRFAM,15.0,8-91
OFBKKLGO_02580_rpsU,TIGR00030,TIGR00030,S21p: ribosomal protein bS21,TIGRFAM,15.0,3-56
OFBKKLGO_02582_mtaB,TIGR01579,TIGR01579,MiaB-like-C: MiaB-like tRNA modifying enzyme,TIGRFAM,15.0,6-423
OFBKKLGO_02582_mtaB,TIGR01574,TIGR01574,miaB-methiolase: tRNA-i(6)A37 thiotransferase enzyme MiaB,TIGRFAM,15.0,6-426
OFBKKLGO_02582_mtaB,TIGR00089,TIGR00089,"TIGR00089: radical SAM methylthiotransferase, MiaB/RimO family",TIGRFAM,15.0,3-431
OFBKKLGO_02583_rsmE,TIGR00046,TIGR00046,"TIGR00046: RNA methyltransferase, RsmE family",TIGRFAM,15.0,3-251
OFBKKLGO_02584_prmA,TIGR00406,TIGR00406,prmA: ribosomal protein L11 methyltransferase,TIGRFAM,15.0,3-305
OFBKKLGO_02585_dnaJ,TIGR02349,TIGR02349,DnaJ_bact: chaperone protein DnaJ,TIGRFAM,15.0,5-351
OFBKKLGO_02587_dnaK,TIGR02350,TIGR02350,prok_dnaK: chaperone protein DnaK,TIGRFAM,15.0,3-573
OFBKKLGO_02589_hrcA,TIGR00331,TIGR00331,hrcA: heat-inducible transcription repressor HrcA,TIGRFAM,15.0,3-336
OFBKKLGO_02591_lepA,TIGR01393,TIGR01393,lepA: elongation factor 4,TIGRFAM,15.0,13-606
OFBKKLGO_02591_lepA,TIGR00231,TIGR00231,small_GTP: small GTP-binding protein domain,TIGRFAM,15.0,15-184
OFBKKLGO_02593_group_6302,TIGR02867,TIGR02867,spore_II_P: stage II sporulation protein P,TIGRFAM,15.0,179-382
OFBKKLGO_02594_gpr,TIGR01441,TIGR01441,GPR: GPR endopeptidase,TIGRFAM,15.0,12-368
OFBKKLGO_02595_rpsT,TIGR00029,TIGR00029,S20: ribosomal protein bS20,TIGRFAM,15.0,1-86
OFBKKLGO_02596_yqeN,TIGR01128,TIGR01128,"holA: DNA polymerase III, delta subunit",TIGRFAM,15.0,15-336
OFBKKLGO_02599_tadA_2,TIGR02571,TIGR02571,ComEB: ComE operon protein 2,TIGRFAM,15.0,2-150
OFBKKLGO_02603_rsfS,TIGR00090,TIGR00090,rsfS_iojap_ybeB: ribosome silencing factor,TIGRFAM,15.0,8-104
OFBKKLGO_02604_group_2904,TIGR00488,TIGR00488,TIGR00488: putative HD superfamily hydrolase,TIGRFAM,15.0,10-181
OFBKKLGO_02606_group_3749,TIGR00253,TIGR00253,"RNA_bind_YhbY: putative RNA-binding protein, YhbY family",TIGRFAM,15.0,2-96
OFBKKLGO_02607_aroE_1,TIGR00507,TIGR00507,aroE: shikimate dehydrogenase,TIGRFAM,15.0,4-275
OFBKKLGO_02608_yqeH,TIGR03597,TIGR03597,GTPase_YqeH: ribosome biogenesis GTPase YqeH,TIGRFAM,15.0,6-366
OFBKKLGO_02609_group_6306,TIGR01549,TIGR01549,"HAD-SF-IA-v1: HAD hydrolase, family IA, variant 1",TIGRFAM,15.0,64-134
OFBKKLGO_02609_group_6306,TIGR01668,TIGR01668,"YqeG_hyp_ppase: HAD phosphatase, family IIIA",TIGRFAM,15.0,7-172
OFBKKLGO_02609_group_6306,TIGR01662,TIGR01662,"HAD-SF-IIIA: HAD hydrolase, family IIIA",TIGRFAM,15.0,32-142
OFBKKLGO_02639_group_2268,TIGR02413,TIGR02413,Bac_small_yrzI: Bacillus tandem small hypothetical protein,TIGRFAM,15.0,1-45
OFBKKLGO_02640_focA,TIGR00790,TIGR00790,fnt: formate/nitrite transporter,TIGRFAM,15.0,21-253
OFBKKLGO_02642_group_2464,TIGR01591,TIGR01591,"Fdh-alpha: formate dehydrogenase, alpha subunit",TIGRFAM,15.0,268-936
OFBKKLGO_02647_mtnN,TIGR01704,TIGR01704,MTA/SAH-Nsdase: MTA/SAH nucleosidase,TIGRFAM,15.0,2-230
OFBKKLGO_02652_greA,TIGR01462,TIGR01462,greA: transcription elongation factor GreA,TIGRFAM,15.0,8-157
OFBKKLGO_02653_udk,TIGR00235,TIGR00235,udk: uridine kinase,TIGRFAM,15.0,4-206
OFBKKLGO_02657_mltG_2,TIGR00247,TIGR00247,"TIGR00247: conserved hypothetical protein, YceG family",TIGRFAM,15.0,15-360
OFBKKLGO_02659_yrrK,TIGR00250,TIGR00250,RNAse_H_YqgF: putative transcription antitermination factor YqgF,TIGRFAM,15.0,4-135
OFBKKLGO_02661_alaS,TIGR00344,TIGR00344,alaS: alanine--tRNA ligase,TIGRFAM,15.0,8-857
OFBKKLGO_02665_glnM,TIGR01726,TIGR01726,"HEQRo_perm_3TM: amino ABC transporter, permease protein, 3-TM region, His/Glu/Gln/Arg/opine family",TIGRFAM,15.0,10-107
OFBKKLGO_02666_glnP,TIGR01726,TIGR01726,"HEQRo_perm_3TM: amino ABC transporter, permease protein, 3-TM region, His/Glu/Gln/Arg/opine family",TIGRFAM,15.0,13-109
OFBKKLGO_02670_recD2,TIGR01448,TIGR01448,"recD_rel: helicase, RecD/TraA family",TIGRFAM,15.0,12-750
OFBKKLGO_02672_mnmA,TIGR00420,TIGR00420,trmU: tRNA (5-methylaminomethyl-2-thiouridylate)-methyltransferase,TIGRFAM,15.0,9-358
OFBKKLGO_02674_cymR,TIGR00738,TIGR00738,rrf2_super: Rrf2 family protein,TIGRFAM,15.0,1-111
OFBKKLGO_02678_aspS,TIGR00459,TIGR00459,aspS_bact: aspartate--tRNA ligase,TIGRFAM,15.0,2-588
OFBKKLGO_02679_hisS,TIGR00442,TIGR00442,hisS: histidine--tRNA ligase,TIGRFAM,15.0,5-409
OFBKKLGO_02684_dtd,TIGR00256,TIGR00256,TIGR00256: D-tyrosyl-tRNA(Tyr) deacylase,TIGRFAM,15.0,1-146
OFBKKLGO_02685_relA,TIGR00691,TIGR00691,spoT_relA: RelA/SpoT family protein,TIGRFAM,15.0,31-731
OFBKKLGO_02686_apt,TIGR01090,TIGR01090,apt: adenine phosphoribosyltransferase,TIGRFAM,15.0,3-170
OFBKKLGO_02687_group_2910,TIGR00644,TIGR00644,recJ: single-stranded-DNA-specific exonuclease RecJ,TIGRFAM,15.0,28-559
OFBKKLGO_02690_secDF,TIGR00916,TIGR00916,"2A0604s01: protein-export membrane protein, SecD/SecF family",TIGRFAM,15.0,554-716;179-398
OFBKKLGO_02690_secDF,TIGR00966,TIGR00966,3a0501s07: protein-export membrane protein SecF,TIGRFAM,15.0,476-719
OFBKKLGO_02690_secDF,TIGR01129,TIGR01129,secD: protein-export membrane protein SecD,TIGRFAM,15.0,33-405
OFBKKLGO_02692_spoVB,TIGR02900,TIGR02900,spore_V_B: stage V sporulation protein B,TIGRFAM,15.0,6-494
OFBKKLGO_02694_group_16240,TIGR04086,TIGR04086,"TIGR04086_membr: putative membrane protein, TIGR04086 family",TIGRFAM,15.0,10-122
OFBKKLGO_02695_yajC,TIGR00739,TIGR00739,"yajC: preprotein translocase, YajC subunit",TIGRFAM,15.0,3-83
OFBKKLGO_02696_tgt,TIGR00449,TIGR00449,tgt_general: tRNA-guanine family transglycosylase,TIGRFAM,15.0,8-374
OFBKKLGO_02696_tgt,TIGR00430,TIGR00430,Q_tRNA_tgt: tRNA-guanine transglycosylase,TIGRFAM,15.0,8-374
OFBKKLGO_02699_ruvB,TIGR00635,TIGR00635,ruvB: Holliday junction DNA helicase RuvB,TIGRFAM,15.0,24-327
OFBKKLGO_02700_ruvA,TIGR00084,TIGR00084,ruvA: Holliday junction DNA helicase RuvA,TIGRFAM,15.0,1-200
OFBKKLGO_02705_nadA,TIGR00550,TIGR00550,"nadA: quinolinate synthetase complex, A subunit",TIGRFAM,15.0,21-365
OFBKKLGO_02712_obg,TIGR03595,TIGR03595,"Obg_CgtA_exten: Obg family GTPase CgtA, C-terminal extension",TIGRFAM,15.0,358-426
OFBKKLGO_02712_obg,TIGR02729,TIGR02729,Obg_CgtA: Obg family GTPase CgtA,TIGRFAM,15.0,2-328
OFBKKLGO_02712_obg,TIGR00231,TIGR00231,small_GTP: small GTP-binding protein domain,TIGRFAM,15.0,160-320
OFBKKLGO_02714_rpmA,TIGR00062,TIGR00062,L27: ribosomal protein bL27,TIGRFAM,15.0,9-89
OFBKKLGO_02716_rplU,TIGR00061,TIGR00061,L21: ribosomal protein bL21,TIGRFAM,15.0,2-101
OFBKKLGO_02720_minD,TIGR01968,TIGR01968,minD_bact: septum site-determining protein MinD,TIGRFAM,15.0,3-263
OFBKKLGO_02721_minC,TIGR01222,TIGR01222,minC: septum site-determining protein MinC,TIGRFAM,15.0,8-209
OFBKKLGO_02722_mreD,TIGR03426,TIGR03426,shape_MreD: rod shape-determining protein MreD,TIGRFAM,15.0,7-159
OFBKKLGO_02723_mreC,TIGR00219,TIGR00219,mreC: rod shape-determining protein MreC,TIGRFAM,15.0,1-284
OFBKKLGO_02724_mreB,TIGR00904,TIGR00904,"mreB: cell shape determining protein, MreB/Mrl family",TIGRFAM,15.0,7-333
