Query_ID,Accession,Name,Description,Library,Library Release,Start_End
OFBKKLGO_00947_hemH,TIGR00109,TIGR00109,hemH: ferrochelatase,TIGRFAM,15.0,3-309
OFBKKLGO_00948_hemY,TIGR00562,TIGR00562,proto_IX_ox: protoporphyrinogen oxidase,TIGRFAM,15.0,5-469
OFBKKLGO_00950_smc_1,TIGR03062,TIGR03062,pip_yhgE_Cterm: YhgE/Pip C-terminal domain,TIGRFAM,15.0,562-764
OFBKKLGO_00950_smc_1,TIGR03057,TIGR03057,xxxLxxG_by_4: X-X-X-Leu-X-X-Gly heptad repeats,TIGRFAM,15.0,468-494
OFBKKLGO_00950_smc_1,TIGR03061,TIGR03061,pip_yhgE_Nterm: YhgE/Pip N-terminal domain,TIGRFAM,15.0,7-170
OFBKKLGO_00951_fabHB,TIGR00747,TIGR00747,fabH: 3-oxoacyl-[acyl-carrier-protein] synthase III,TIGRFAM,15.0,3-323
OFBKKLGO_00956_lplJ,TIGR00545,TIGR00545,lipoyltrans: lipoyltransferase and lipoate-protein ligase,TIGRFAM,15.0,2-323
OFBKKLGO_00964_yhfS,TIGR01930,TIGR01930,AcCoA-C-Actrans: acetyl-CoA C-acyltransferase,TIGRFAM,15.0,5-360
OFBKKLGO_00981_sipV,TIGR02227,TIGR02227,sigpep_I_bact: signal peptidase I,TIGRFAM,15.0,9-165
OFBKKLGO_00984_group_3519,TIGR03082,TIGR03082,Gneg_AbrB_dup: membrane protein AbrB duplication,TIGRFAM,15.0,206-365;11-172
OFBKKLGO_00989_addB,TIGR02773,TIGR02773,"addB_Gpos: helicase-exonuclease AddAB, AddB subunit",TIGRFAM,15.0,2-1163
OFBKKLGO_00990_addA,TIGR02785,TIGR02785,"addA_Gpos: helicase-exonuclease AddAB, AddA subunit",TIGRFAM,15.0,11-1233
OFBKKLGO_00991_cpdA_1,TIGR00619,TIGR00619,"sbcd: exonuclease SbcCD, D subunit",TIGRFAM,15.0,1-252
OFBKKLGO_01005_asnO,TIGR01536,TIGR01536,asn_synth_AEB: asparagine synthase (glutamine-hydrolyzing),TIGRFAM,15.0,2-532
OFBKKLGO_01007_yeeO,TIGR00797,TIGR00797,matE: MATE efflux family protein,TIGRFAM,15.0,37-436
OFBKKLGO_01024_group_1434,TIGR00762,TIGR00762,"DegV: EDD domain protein, DegV family",TIGRFAM,15.0,4-280
OFBKKLGO_01029_yitU,TIGR00099,TIGR00099,Cof-subfamily: Cof-like hydrolase,TIGRFAM,15.0,7-264
OFBKKLGO_01029_yitU,TIGR01484,TIGR01484,"HAD-SF-IIB: HAD hydrolase, family IIB",TIGRFAM,15.0,7-237
OFBKKLGO_01035_punA,TIGR01700,TIGR01700,"PNPH: purine nucleoside phosphorylase I, inosine and guanosine-specific",TIGRFAM,15.0,21-268
OFBKKLGO_01035_punA,TIGR01697,TIGR01697,PNPH-PUNA-XAPA: inosine/guanosine/xanthosine phosphorylase family,TIGRFAM,15.0,21-267
OFBKKLGO_01037_spoIIAA,TIGR02886,TIGR02886,spore_II_AA: anti-sigma F factor antagonist,TIGRFAM,15.0,5-110
OFBKKLGO_01037_spoIIAA,TIGR00377,TIGR00377,ant_ant_sig: anti-anti-sigma factor,TIGRFAM,15.0,1-106
OFBKKLGO_01038_spoIIAB,TIGR01925,TIGR01925,spIIAB: anti-sigma F factor,TIGRFAM,15.0,1-137
OFBKKLGO_01039_sigF,TIGR02885,TIGR02885,spore_sigF: RNA polymerase sigma-F factor,TIGRFAM,15.0,22-249
OFBKKLGO_01039_sigF,TIGR02980,TIGR02980,"SigBFG: RNA polymerase sigma-70 factor, sigma-B/F/G subfamily",TIGRFAM,15.0,30-250
OFBKKLGO_01039_sigF,TIGR02937,TIGR02937,"sigma70-ECF: RNA polymerase sigma factor, sigma-70 family",TIGRFAM,15.0,33-250
OFBKKLGO_01042_group_16180,TIGR02838,TIGR02838,spore_V_AC: stage V sporulation protein AC,TIGRFAM,15.0,7-143
OFBKKLGO_01043_spoVAD,TIGR02845,TIGR02845,spore_V_AD: stage V sporulation protein AD,TIGRFAM,15.0,6-332
OFBKKLGO_01044_group_5946,TIGR02839,TIGR02839,spore_V_AE: stage V sporulation protein AE,TIGRFAM,15.0,3-116
OFBKKLGO_01051_sipS,TIGR02227,TIGR02227,sigpep_I_bact: signal peptidase I,TIGRFAM,15.0,17-180
OFBKKLGO_01054_ribD,TIGR00326,TIGR00326,eubact_ribD: riboflavin biosynthesis protein RibD,TIGRFAM,15.0,6-355
OFBKKLGO_01054_ribD,TIGR00227,TIGR00227,ribD_Cterm: riboflavin-specific deaminase C-terminal domain,TIGRFAM,15.0,145-356
OFBKKLGO_01055_ribE,TIGR00187,TIGR00187,"ribE: riboflavin synthase, alpha subunit",TIGRFAM,15.0,1-201
OFBKKLGO_01056_ribBA,TIGR00505,TIGR00505,ribA: GTP cyclohydrolase II,TIGRFAM,15.0,207-396
OFBKKLGO_01056_ribBA,TIGR00506,TIGR00506,"ribB: 3,4-dihydroxy-2-butanone-4-phosphate synthase",TIGRFAM,15.0,1-197
OFBKKLGO_01057_ribH,TIGR00114,TIGR00114,"lumazine-synth: 6,7-dimethyl-8-ribityllumazine synthase",TIGRFAM,15.0,13-149
OFBKKLGO_01060_group_5952,TIGR01732,TIGR01732,tiny_TM_bacill: conserved hypothetical protein,TIGRFAM,15.0,3-28
OFBKKLGO_01062_scpB,TIGR00281,TIGR00281,TIGR00281: segregation and condensation protein B,TIGRFAM,15.0,7-195
OFBKKLGO_01067_rluB,TIGR00093,TIGR00093,TIGR00093: pseudouridine synthase,TIGRFAM,15.0,66-226
OFBKKLGO_01070_ccsA_1,TIGR03144,TIGR03144,cytochr_II_ccsB: cytochrome c-type biogenesis protein CcsB,TIGRFAM,15.0,48-391
OFBKKLGO_01073_sigX,TIGR02937,TIGR02937,"sigma70-ECF: RNA polymerase sigma factor, sigma-70 family",TIGRFAM,15.0,5-165
OFBKKLGO_01075_serA,TIGR01327,TIGR01327,PGDH: phosphoglycerate dehydrogenase,TIGRFAM,15.0,3-524
OFBKKLGO_01080_dbpA_2,TIGR00614,TIGR00614,"recQ_fam: ATP-dependent DNA helicase, RecQ family",TIGRFAM,15.0,2-313
OFBKKLGO_01090_sleB,TIGR02869,TIGR02869,spore_SleB: spore cortex-lytic enzyme,TIGRFAM,15.0,28-288
OFBKKLGO_01091_ypeB,TIGR02889,TIGR02889,spore_YpeB: germination protein YpeB,TIGRFAM,15.0,3-439
OFBKKLGO_01094_cmk,TIGR00017,TIGR00017,cmk: cytidylate kinase,TIGRFAM,15.0,4-217
OFBKKLGO_01096_fni,TIGR02151,TIGR02151,"IPP_isom_2: isopentenyl-diphosphate delta-isomerase, type 2",TIGRFAM,15.0,5-329
OFBKKLGO_01099_der_2,TIGR00231,TIGR00231,small_GTP: small GTP-binding protein domain,TIGRFAM,15.0,3-125;180-324
OFBKKLGO_01099_der_2,TIGR03594,TIGR03594,GTPase_EngA: ribosome-associated GTPase EngA,TIGRFAM,15.0,4-432
OFBKKLGO_01104_spoIVA,TIGR02836,TIGR02836,spore_IV_A: stage IV sporulation protein A,TIGRFAM,15.0,1-492
OFBKKLGO_01106_folE,TIGR00063,TIGR00063,folE: GTP cyclohydrolase I,TIGRFAM,15.0,9-188
OFBKKLGO_01109_menG,TIGR02752,TIGR02752,MenG_heptapren: demethylmenaquinone methyltransferase,TIGRFAM,15.0,3-233
OFBKKLGO_01109_menG,TIGR01934,TIGR01934,MenG_MenH_UbiE: ubiquinone/menaquinone biosynthesis methyltransferase,TIGRFAM,15.0,9-233
OFBKKLGO_01110_hepT,TIGR02748,TIGR02748,GerC3_HepT: heptaprenyl diphosphate synthase component II,TIGRFAM,15.0,31-349
OFBKKLGO_01113_aroC,TIGR00033,TIGR00033,aroC: chorismate synthase,TIGRFAM,15.0,1-369
OFBKKLGO_01114_aroB,TIGR01357,TIGR01357,aroB: 3-dehydroquinate synthase,TIGRFAM,15.0,13-348
OFBKKLGO_01115_aroH,TIGR01796,TIGR01796,CM_mono_aroH: chorismate mutase,TIGRFAM,15.0,3-119
OFBKKLGO_01117_trpE,TIGR00564,TIGR00564,trpE_most: anthranilate synthase component I,TIGRFAM,15.0,29-492
OFBKKLGO_01121_trpB,TIGR00263,TIGR00263,"trpB: tryptophan synthase, beta subunit",TIGRFAM,15.0,9-390
OFBKKLGO_01122_trpA,TIGR00262,TIGR00262,"trpA: tryptophan synthase, alpha subunit",TIGRFAM,15.0,6-258
OFBKKLGO_01123_hisC_2,TIGR01141,TIGR01141,hisC: histidinol-phosphate transaminase,TIGRFAM,15.0,5-359
OFBKKLGO_01125_aroA1,TIGR01356,TIGR01356,aroA: 3-phosphoshikimate 1-carboxyvinyltransferase,TIGRFAM,15.0,11-426
OFBKKLGO_01133_group_5970,TIGR02878,TIGR02878,spore_ypjB: sporulation protein YpjB,TIGRFAM,15.0,28-254
OFBKKLGO_01134_oxdC_1,TIGR03404,TIGR03404,"bicupin_oxalic: bicupin, oxalate decarboxylase family",TIGRFAM,15.0,20-385
OFBKKLGO_01137_dapB,TIGR00036,TIGR00036,dapB: 4-hydroxy-tetrahydrodipicolinate reductase,TIGRFAM,15.0,5-267
OFBKKLGO_01138_mgsA,TIGR00160,TIGR00160,MGSA: methylglyoxal synthase,TIGRFAM,15.0,1-119
OFBKKLGO_01139_bshB1_1,TIGR04001,TIGR04001,thiol_BshB1: bacillithiol biosynthesis deacetylase BshB1,TIGRFAM,15.0,5-225
OFBKKLGO_01140_bshA,TIGR03999,TIGR03999,thiol_BshA: N-acetyl-alpha-D-glucosaminyl L-malate synthase BshA,TIGRFAM,15.0,4-373
OFBKKLGO_01142_birA,TIGR00122,TIGR00122,birA_repr_reg: biotin operon repressor,TIGRFAM,15.0,9-77
OFBKKLGO_01142_birA,TIGR00121,TIGR00121,birA_ligase: biotin--[acetyl-CoA-carboxylase] ligase,TIGRFAM,15.0,87-324
OFBKKLGO_01144_panB,TIGR00222,TIGR00222,panB: 3-methyl-2-oxobutanoate hydroxymethyltransferase,TIGRFAM,15.0,1-264
OFBKKLGO_01146_panD,TIGR00223,TIGR00223,panD: aspartate 1-decarboxylase,TIGRFAM,15.0,1-126
OFBKKLGO_01147_dinG,TIGR01407,TIGR01407,dinG_rel: putative DnaQ family exonuclease/DinG family helicase,TIGRFAM,15.0,5-910
OFBKKLGO_01147_dinG,TIGR00573,TIGR00573,"dnaq: exonuclease, DNA polymerase III, epsilon subunit family",TIGRFAM,15.0,2-172
OFBKKLGO_01151_asnS,TIGR00457,TIGR00457,asnS: asparagine--tRNA ligase,TIGRFAM,15.0,2-429
OFBKKLGO_01152_dnaD,TIGR01446,TIGR01446,DnaD_dom: DnaD domain protein,TIGRFAM,15.0,129-201
OFBKKLGO_01153_nth,TIGR01083,TIGR01083,nth: endonuclease III,TIGRFAM,15.0,5-196
OFBKKLGO_01156_recU,TIGR00648,TIGR00648,recU: recombination protein U,TIGRFAM,15.0,30-196
OFBKKLGO_01164_crr,TIGR00830,TIGR00830,"PTBA: PTS system, glucose subfamily, IIA component",TIGRFAM,15.0,20-140
OFBKKLGO_01170_gpsB,TIGR03544,TIGR03544,DivI1A_domain: DivIVA domain,TIGRFAM,15.0,8-41
OFBKKLGO_01179_xpt,TIGR01744,TIGR01744,XPRTase: xanthine phosphoribosyltransferase,TIGRFAM,15.0,2-191
OFBKKLGO_01388_sspL,TIGR03093,TIGR03093,"SASP_sspL: small, acid-soluble spore protein L",TIGRFAM,15.0,6-41
OFBKKLGO_01390_group_16277,TIGR00697,TIGR00697,TIGR00697: conserved hypothetical integral membrane protein,TIGRFAM,15.0,26-223
OFBKKLGO_01397_metAA,TIGR01001,TIGR01001,metA: homoserine O-succinyltransferase,TIGRFAM,15.0,2-300
OFBKKLGO_01403_group_6022,TIGR04191,TIGR04191,"YphP_YqiW: putative bacilliredoxin, YphP/YqiW family",TIGRFAM,15.0,8-144
OFBKKLGO_01406_thyA2,TIGR03284,TIGR03284,thym_sym: thymidylate synthase,TIGRFAM,15.0,84-264;2-85
OFBKKLGO_01409_group_3569,TIGR01065,TIGR01065,"hlyIII: channel protein, hemolysin III family",TIGRFAM,15.0,6-206
OFBKKLGO_01411_ilvA,TIGR02079,TIGR02079,THD1: threonine dehydratase,TIGRFAM,15.0,14-422
OFBKKLGO_01438_scoB_2,TIGR02428,TIGR02428,"pcaJ_scoB_fam: 3-oxoacid CoA-transferase, B subunit",TIGRFAM,15.0,7-211
OFBKKLGO_01439_ylmB_2,TIGR01910,TIGR01910,"DapE-ArgE: peptidase, ArgE/DapE family",TIGRFAM,15.0,20-409
OFBKKLGO_01441_kamA,TIGR03820,TIGR03820,"lys_2_3_AblA: lysine-2,3-aminomutase",TIGRFAM,15.0,23-427
OFBKKLGO_01441_kamA,TIGR00238,TIGR00238,TIGR00238: KamA family protein,TIGRFAM,15.0,13-342
OFBKKLGO_01442_group_1236,TIGR03831,TIGR03831,YgiT_finger: YgiT-type zinc finger domain,TIGRFAM,15.0,4-50
OFBKKLGO_01442_group_1236,TIGR03829,TIGR03829,"YokU_near_AblA: uncharacterized protein, YokU family",TIGRFAM,15.0,4-91
OFBKKLGO_01451_deoD,TIGR00107,TIGR00107,deoD: purine nucleoside phosphorylase,TIGRFAM,15.0,4-232
OFBKKLGO_01455_ctpA,TIGR00225,TIGR00225,prc: C-terminal processing peptidase,TIGRFAM,15.0,55-380
OFBKKLGO_01471_bshB2,TIGR04000,TIGR04000,thiol_BshB2: bacillithiol biosynthesis deacetylase BshB2,TIGRFAM,15.0,3-219
OFBKKLGO_01473_norM,TIGR00797,TIGR00797,matE: MATE efflux family protein,TIGRFAM,15.0,20-421
OFBKKLGO_01475_oleD_2,TIGR01426,TIGR01426,"MGT: glycosyltransferase, MGT family",TIGRFAM,15.0,8-393
OFBKKLGO_01480_odhA,TIGR00239,TIGR00239,"2oxo_dh_E1: oxoglutarate dehydrogenase (succinyl-transferring), E1 component",TIGRFAM,15.0,16-939
OFBKKLGO_01481_odhB,TIGR01347,TIGR01347,"sucB: dihydrolipoyllysine-residue succinyltransferase, E2 component of oxoglutarate dehydrogenase (succinyl-transferring) complex",TIGRFAM,15.0,3-414
OFBKKLGO_01483_panS,TIGR00841,TIGR00841,bass: bile acid transporter,TIGRFAM,15.0,8-307
OFBKKLGO_01499_recQ,TIGR01389,TIGR01389,recQ: ATP-dependent DNA helicase RecQ,TIGRFAM,15.0,6-587
OFBKKLGO_01499_recQ,TIGR00614,TIGR00614,"recQ_fam: ATP-dependent DNA helicase, RecQ family",TIGRFAM,15.0,8-458
OFBKKLGO_01512_csaA,TIGR02222,TIGR02222,chap_CsaA: export-related chaperone protein CsaA,TIGRFAM,15.0,5-109
OFBKKLGO_01530_proC_1,TIGR00112,TIGR00112,proC: pyrroline-5-carboxylate reductase,TIGRFAM,15.0,1-254
OFBKKLGO_01531_proB_2,TIGR01027,TIGR01027,proB: glutamate 5-kinase,TIGRFAM,15.0,8-355
OFBKKLGO_01534_gltB,TIGR01317,TIGR01317,"GOGAT_sm_gam: glutamate synthase, NADH/NADPH, small subunit",TIGRFAM,15.0,3-493
OFBKKLGO_01542_group_4639,TIGR01764,TIGR01764,"excise: DNA binding domain, excisionase family",TIGRFAM,15.0,2-50
OFBKKLGO_01545_mepA,TIGR00797,TIGR00797,matE: MATE efflux family protein,TIGRFAM,15.0,27-430
OFBKKLGO_01563_bioK,TIGR00508,TIGR00508,bioA: adenosylmethionine-8-amino-7-oxononanoate transaminase,TIGRFAM,15.0,13-440
OFBKKLGO_01566_bioB,TIGR00433,TIGR00433,bioB: biotin synthase,TIGRFAM,15.0,27-320
OFBKKLGO_01583_alsT_1,TIGR00835,TIGR00835,agcS: amino acid carrier protein,TIGRFAM,15.0,17-432
OFBKKLGO_01586_parC,TIGR01061,TIGR01061,"parC_Gpos: DNA topoisomerase IV, A subunit",TIGRFAM,15.0,7-744
OFBKKLGO_01586_parC,TIGR01063,TIGR01063,"gyrA: DNA gyrase, A subunit",TIGRFAM,15.0,12-793
OFBKKLGO_01587_parE,TIGR01058,TIGR01058,"parE_Gpos: DNA topoisomerase IV, B subunit",TIGRFAM,15.0,8-643
OFBKKLGO_01589_plsY,TIGR00023,TIGR00023,TIGR00023: acyl-phosphate glycerol 3-phosphate acyltransferase,TIGRFAM,15.0,1-192
OFBKKLGO_01592_group_4649,TIGR00051,TIGR00051,"TIGR00051: acyl-CoA thioester hydrolase, YbgC/YbaW family",TIGRFAM,15.0,9-123
OFBKKLGO_01593_tlp,TIGR03090,TIGR03090,"SASP_tlp: small, acid-soluble spore protein tlp",TIGRFAM,15.0,8-74
OFBKKLGO_01596_citB,TIGR01341,TIGR01341,aconitase_1: aconitate hydratase 1,TIGRFAM,15.0,24-906
OFBKKLGO_01597_sspO,TIGR02864,TIGR02864,"spore_sspO: small, acid-soluble spore protein O",TIGRFAM,15.0,1-48
OFBKKLGO_01607_tkt,TIGR00232,TIGR00232,tktlase_bact: transketolase,TIGRFAM,15.0,6-666
OFBKKLGO_01611_lexA,TIGR00498,TIGR00498,lexA: repressor LexA,TIGRFAM,15.0,1-205
OFBKKLGO_01624_group_3606,TIGR01732,TIGR01732,tiny_TM_bacill: conserved hypothetical protein,TIGRFAM,15.0,2-26
OFBKKLGO_01657_glnA,TIGR00653,TIGR00653,"GlnA: glutamine synthetase, type I",TIGRFAM,15.0,7-441
OFBKKLGO_01660_hflX,TIGR03156,TIGR03156,GTP_HflX: GTP-binding protein HflX,TIGRFAM,15.0,11-358
OFBKKLGO_01665_nrdF,TIGR04171,TIGR04171,"RNR_1b_NrdF: ribonucleoside-diphosphate reductase, class 1b, beta subunit",TIGRFAM,15.0,5-322
OFBKKLGO_01666_nrdE,TIGR04170,TIGR04170,"RNR_1b_NrdE: ribonucleoside-diphosphate reductase, class 1b, alpha subunit",TIGRFAM,15.0,8-700
OFBKKLGO_01666_nrdE,TIGR02506,TIGR02506,"NrdE_NrdA: ribonucleoside-diphosphate reductase, alpha subunit",TIGRFAM,15.0,95-688
OFBKKLGO_01670_hfq,TIGR02383,TIGR02383,Hfq: RNA chaperone Hfq,TIGRFAM,15.0,5-64
OFBKKLGO_01671_miaA,TIGR00174,TIGR00174,miaA: tRNA dimethylallyltransferase,TIGRFAM,15.0,8-293
OFBKKLGO_01676_group_4659,TIGR03563,TIGR03563,"perox_SACOL1771: peroxiredoxin, SACOL1771 subfamily",TIGRFAM,15.0,4-141
OFBKKLGO_01696_baeC,TIGR00128,TIGR00128,fabD: malonyl CoA-acyl carrier protein transacylase,TIGRFAM,15.0,1-282
OFBKKLGO_01698_mutL,TIGR00585,TIGR00585,mutl: DNA mismatch repair protein MutL,TIGRFAM,15.0,3-306
OFBKKLGO_01699_mutS,TIGR01070,TIGR01070,mutS1: DNA mismatch repair protein MutS,TIGRFAM,15.0,5-859
OFBKKLGO_01702_miaB,TIGR00089,TIGR00089,"TIGR00089: radical SAM methylthiotransferase, MiaB/RimO family",TIGRFAM,15.0,67-499
OFBKKLGO_01702_miaB,TIGR01574,TIGR01574,miaB-methiolase: tRNA-i(6)A37 thiotransferase enzyme MiaB,TIGRFAM,15.0,67-501
OFBKKLGO_01703_group_6081,TIGR00858,TIGR00858,bioF: 8-amino-7-oxononanoate synthase,TIGRFAM,15.0,22-381
OFBKKLGO_01703_group_6081,TIGR01825,TIGR01825,gly_Cac_T_rel: putative pyridoxal phosphate-dependent acyltransferase,TIGRFAM,15.0,7-391
OFBKKLGO_01704_tdh_1,TIGR00692,TIGR00692,tdh: L-threonine 3-dehydrogenase,TIGRFAM,15.0,8-347
OFBKKLGO_01706_ymdB,TIGR00282,TIGR00282,"TIGR00282: metallophosphoesterase, MG_246/BB_0505 family",TIGRFAM,15.0,1-264
OFBKKLGO_01707_rny,TIGR00277,TIGR00277,HDIG: HDIG domain,TIGRFAM,15.0,331-408
OFBKKLGO_01707_rny,TIGR03319,TIGR03319,RNase_Y: ribonuclease Y,TIGRFAM,15.0,7-519
OFBKKLGO_01709_recA,TIGR02012,TIGR02012,tigrfam_recA: protein RecA,TIGRFAM,15.0,3-323
OFBKKLGO_01710_cinA,TIGR00199,TIGR00199,"PncC_domain: amidohydrolase, PncC family",TIGRFAM,15.0,267-413
OFBKKLGO_01710_cinA,TIGR00177,TIGR00177,molyb_syn: molybdenum cofactor synthesis domain,TIGRFAM,15.0,6-169
OFBKKLGO_01710_cinA,TIGR00200,TIGR00200,cinA_nterm: competence/damage-inducible protein CinA N-terminal domain,TIGRFAM,15.0,5-416
OFBKKLGO_01711_pgsA,TIGR00560,TIGR00560,pgsA: CDP-diacylglycerol--glycerol-3-phosphate 3-phosphatidyltransferase,TIGRFAM,15.0,2-191
OFBKKLGO_01725_rnjB,TIGR00649,TIGR00649,"MG423: beta-CASP ribonuclease, RNase J family",TIGRFAM,15.0,20-564
OFBKKLGO_01726_dapA_2,TIGR00674,TIGR00674,dapA: 4-hydroxy-tetrahydrodipicolinate synthase,TIGRFAM,15.0,6-288
OFBKKLGO_01727_lysC_1,TIGR00656,TIGR00656,"asp_kin_monofn: aspartate kinase, monofunctional class",TIGRFAM,15.0,2-403
OFBKKLGO_01727_lysC_1,TIGR00657,TIGR00657,asp_kinases: aspartate kinase,TIGRFAM,15.0,67-401
OFBKKLGO_01728_asd,TIGR01296,TIGR01296,asd_B: aspartate-semialdehyde dehydrogenase,TIGRFAM,15.0,6-342
OFBKKLGO_01729_dpaB,TIGR02852,TIGR02852,"spore_dpaB: dipicolinic acid synthetase, B subunit",TIGRFAM,15.0,6-192
OFBKKLGO_01730_dpaA,TIGR02853,TIGR02853,"spore_dpaA: dipicolinic acid synthetase, A subunit",TIGRFAM,15.0,5-289
OFBKKLGO_01731_group_16156,TIGR02888,TIGR02888,"spore_YlmC_YmxH: sporulation protein, YlmC/YmxH family",TIGRFAM,15.0,2-76
OFBKKLGO_01733_group_4667,TIGR02873,TIGR02873,"spore_ylxY: probable sporulation protein, polysaccharide deacetylase family",TIGRFAM,15.0,46-313
OFBKKLGO_01734_pnp_2,TIGR03591,TIGR03591,polynuc_phos: polyribonucleotide nucleotidyltransferase,TIGRFAM,15.0,12-693
OFBKKLGO_01735_rpsO,TIGR00952,TIGR00952,S15_bact: ribosomal protein uS15,TIGRFAM,15.0,4-89
OFBKKLGO_01736_ribF,TIGR00125,TIGR00125,cyt_tran_rel: cytidyltransferase-like domain,TIGRFAM,15.0,21-86
OFBKKLGO_01736_ribF,TIGR00083,TIGR00083,ribF: riboflavin biosynthesis protein RibF,TIGRFAM,15.0,21-312
OFBKKLGO_01737_truB,TIGR00431,TIGR00431,TruB: tRNA pseudouridine(55) synthase,TIGRFAM,15.0,2-217
OFBKKLGO_01738_rbfA,TIGR00082,TIGR00082,rbfA: ribosome-binding factor A,TIGRFAM,15.0,3-112
OFBKKLGO_01740_infB,TIGR00231,TIGR00231,small_GTP: small GTP-binding protein domain,TIGRFAM,15.0,221-377
OFBKKLGO_01740_infB,TIGR00487,TIGR00487,IF-2: translation initiation factor IF-2,TIGRFAM,15.0,134-716
OFBKKLGO_01743_nusA,TIGR01953,TIGR01953,NusA: transcription termination factor NusA,TIGRFAM,15.0,5-341
OFBKKLGO_01747_rasP,TIGR00054,TIGR00054,TIGR00054: RIP metalloprotease RseP,TIGRFAM,15.0,2-419
OFBKKLGO_01748_dxr,TIGR00243,TIGR00243,Dxr: 1-deoxy-D-xylulose 5-phosphate reductoisomerase,TIGRFAM,15.0,1-378
OFBKKLGO_01750_uppS,TIGR00055,TIGR00055,"uppS: di-trans,poly-cis-decaprenylcistransferase",TIGRFAM,15.0,31-258
OFBKKLGO_01751_frr,TIGR00496,TIGR00496,frr: ribosome recycling factor,TIGRFAM,15.0,10-185
OFBKKLGO_01752_pyrH,TIGR02075,TIGR02075,pyrH_bact: UMP kinase,TIGRFAM,15.0,6-237
OFBKKLGO_01753_tsf,TIGR00116,TIGR00116,tsf: translation elongation factor Ts,TIGRFAM,15.0,1-293
OFBKKLGO_01754_rpsB,TIGR01011,TIGR01011,rpsB_bact: ribosomal protein uS2,TIGRFAM,15.0,3-226
OFBKKLGO_01756_sigD,TIGR02479,TIGR02479,"FliA_WhiG: RNA polymerase sigma factor, FliA/WhiG family",TIGRFAM,15.0,27-249
OFBKKLGO_01756_sigD,TIGR02937,TIGR02937,"sigma70-ECF: RNA polymerase sigma factor, sigma-70 family",TIGRFAM,15.0,25-248
OFBKKLGO_01764_flhA,TIGR01398,TIGR01398,FlhA: flagellar biosynthesis protein FlhA,TIGRFAM,15.0,4-675
OFBKKLGO_01765_flhB_2,TIGR00328,TIGR00328,flhB: flagellar biosynthetic protein FlhB,TIGRFAM,15.0,14-359
OFBKKLGO_01766_fliR,TIGR01400,TIGR01400,fliR: flagellar biosynthetic protein FliR,TIGRFAM,15.0,10-253
OFBKKLGO_01767_fliQ,TIGR01402,TIGR01402,fliQ: flagellar biosynthetic protein FliQ,TIGRFAM,15.0,3-87
OFBKKLGO_01768_fliP,TIGR01103,TIGR01103,fliP: flagellar biosynthetic protein FliP,TIGRFAM,15.0,25-221
OFBKKLGO_01772_fliM,TIGR01397,TIGR01397,fliM_switch: flagellar motor switch protein FliM,TIGRFAM,15.0,4-322
OFBKKLGO_01774_flgG_1,TIGR03506,TIGR03506,FlgEFG_subfam: flagellar hook-basal body protein,TIGRFAM,15.0,3-128;144-239
OFBKKLGO_01774_flgG_1,TIGR02490,TIGR02490,flgF: flagellar basal-body rod protein FlgF,TIGRFAM,15.0,5-237
OFBKKLGO_01778_fliJ,TIGR02473,TIGR02473,flagell_FliJ: flagellar export protein FliJ,TIGRFAM,15.0,4-143
OFBKKLGO_01779_yscN,TIGR03497,TIGR03497,FliI_clade2: flagellar protein export ATPase FliI,TIGRFAM,15.0,20-433
OFBKKLGO_01779_yscN,TIGR01026,TIGR01026,"fliI_yscN: ATPase, FliI/YscN family",TIGRFAM,15.0,13-434
OFBKKLGO_01781_fliG,TIGR00207,TIGR00207,fliG: flagellar motor switch protein FliG,TIGRFAM,15.0,1-338
OFBKKLGO_01782_group_4676,TIGR00206,TIGR00206,fliF: flagellar M-ring protein FliF,TIGRFAM,15.0,1-536
OFBKKLGO_01783_fliE,TIGR00205,TIGR00205,fliE: flagellar hook-basal body complex protein FliE,TIGRFAM,15.0,3-106
OFBKKLGO_01784_flgC,TIGR01395,TIGR01395,FlgC: flagellar basal-body rod protein FlgC,TIGRFAM,15.0,4-150
OFBKKLGO_01787_codY,TIGR02787,TIGR02787,codY_Gpos: GTP-sensing transcriptional pleiotropic repressor CodY,TIGRFAM,15.0,3-253
OFBKKLGO_01788_clpY,TIGR00390,TIGR00390,"hslU: ATP-dependent protease HslVU, ATPase subunit",TIGRFAM,15.0,6-467
OFBKKLGO_01789_clpQ,TIGR03692,TIGR03692,"ATP_dep_HslV: ATP-dependent protease HslVU, peptidase subunit",TIGRFAM,15.0,7-180
OFBKKLGO_01790_xerC_1,TIGR02224,TIGR02224,recomb_XerC: tyrosine recombinase XerC,TIGRFAM,15.0,11-302
OFBKKLGO_01791_trmFO,TIGR00137,TIGR00137,gid_trmFO: tRNA:m(5)U-54 methyltransferase,TIGRFAM,15.0,4-435
OFBKKLGO_01792_topA,TIGR01051,TIGR01051,topA_bact: DNA topoisomerase I,TIGRFAM,15.0,5-611
OFBKKLGO_01793_dprA,TIGR00732,TIGR00732,dprA: DNA protecting protein DprA,TIGRFAM,15.0,72-284
OFBKKLGO_01794_sucD,TIGR01019,TIGR01019,"sucCoAalpha: succinate-CoA ligase, alpha subunit",TIGRFAM,15.0,4-288
OFBKKLGO_01795_sucC,TIGR01016,TIGR01016,"sucCoAbeta: succinate-CoA ligase, beta subunit",TIGRFAM,15.0,1-384
OFBKKLGO_01796_flhB_1,TIGR00789,TIGR00789,flhB_rel: FlhB domain protein,TIGRFAM,15.0,8-88
OFBKKLGO_01799_rbgA,TIGR03596,TIGR03596,GTPase_YlqF: ribosome biogenesis GTP-binding protein YlqF,TIGRFAM,15.0,3-278
OFBKKLGO_01800_rplS,TIGR01024,TIGR01024,rplS_bact: ribosomal protein bL19,TIGRFAM,15.0,2-113
OFBKKLGO_01802_trmD,TIGR00088,TIGR00088,trmD: tRNA (guanine(37)-N(1))-methyltransferase,TIGRFAM,15.0,1-235
OFBKKLGO_01803_rimM,TIGR02273,TIGR02273,16S_RimM: 16S rRNA processing protein RimM,TIGRFAM,15.0,5-171
OFBKKLGO_01806_rpsP,TIGR00002,TIGR00002,S16: ribosomal protein bS16,TIGRFAM,15.0,3-80
OFBKKLGO_01807_ffh,TIGR00959,TIGR00959,ffh: signal recognition particle protein,TIGRFAM,15.0,3-429
OFBKKLGO_01809_ftsY,TIGR00064,TIGR00064,ftsY: signal recognition particle-docking protein FtsY,TIGRFAM,15.0,46-320
OFBKKLGO_01810_smc_3,TIGR02168,TIGR02168,SMC_prok_B: chromosome segregation protein SMC,TIGRFAM,15.0,2-1178
OFBKKLGO_01811_rnc,TIGR02191,TIGR02191,RNaseIII: ribonuclease III,TIGRFAM,15.0,23-242
OFBKKLGO_01812_acpA,TIGR00517,TIGR00517,acyl_carrier: acyl carrier protein,TIGRFAM,15.0,2-77
OFBKKLGO_01813_fabG_1,TIGR01830,TIGR01830,3oxo_ACP_reduc: 3-oxoacyl-[acyl-carrier-protein] reductase,TIGRFAM,15.0,7-245
OFBKKLGO_01814_fabD,TIGR00128,TIGR00128,fabD: malonyl CoA-acyl carrier protein transacylase,TIGRFAM,15.0,3-291
OFBKKLGO_01815_plsX,TIGR00182,TIGR00182,plsX: fatty acid/phospholipid synthesis protein PlsX,TIGRFAM,15.0,1-329
OFBKKLGO_01817_recG,TIGR00643,TIGR00643,recG: ATP-dependent DNA helicase RecG,TIGRFAM,15.0,26-648
OFBKKLGO_01818_sdhA,TIGR00718,TIGR00718,"sda_alpha: L-serine dehydratase, iron-sulfur-dependent, alpha subunit",TIGRFAM,15.0,1-300
OFBKKLGO_01819_sdhB,TIGR00719,TIGR00719,"sda_beta: L-serine dehydratase, iron-sulfur-dependent, beta subunit",TIGRFAM,15.0,1-206
OFBKKLGO_01820_group_4680,TIGR03599,TIGR03599,YloV: DAK2 domain fusion protein YloV,TIGRFAM,15.0,11-555
OFBKKLGO_01822_rpmB,TIGR00009,TIGR00009,L28: ribosomal protein bL28,TIGRFAM,15.0,1-56
OFBKKLGO_01824_rpe,TIGR01163,TIGR01163,rpe: ribulose-phosphate 3-epimerase,TIGRFAM,15.0,3-214
OFBKKLGO_01825_rsgA,TIGR00157,TIGR00157,TIGR00157: ribosome small subunit-dependent GTPase A,TIGRFAM,15.0,41-286
OFBKKLGO_01828_rlmN,TIGR00048,TIGR00048,rRNA_mod_RlmN: 23S rRNA (adenine(2503)-C(2))-methyltransferase,TIGRFAM,15.0,14-363
OFBKKLGO_01829_rsmB,TIGR00563,TIGR00563,rsmB: 16S rRNA (cytosine(967)-C(5))-methyltransferase,TIGRFAM,15.0,7-447
OFBKKLGO_01830_fmt,TIGR00460,TIGR00460,fmt: methionyl-tRNA formyltransferase,TIGRFAM,15.0,1-303
OFBKKLGO_01831_def1,TIGR00079,TIGR00079,pept_deformyl: peptide deformylase,TIGRFAM,15.0,4-158
OFBKKLGO_01833_undec1A,TIGR00521,TIGR00521,coaBC_dfp: phosphopantothenoylcysteine decarboxylase / phosphopantothenate--cysteine ligase,TIGRFAM,15.0,2-395
OFBKKLGO_01834_rpoZ,TIGR00690,TIGR00690,"rpoZ: DNA-directed RNA polymerase, omega subunit",TIGRFAM,15.0,1-60
OFBKKLGO_01835_gmk,TIGR03263,TIGR03263,guanyl_kin: guanylate kinase,TIGRFAM,15.0,13-192
OFBKKLGO_01837_group_6120,TIGR00255,TIGR00255,TIGR00255: TIGR00255 family protein,TIGRFAM,15.0,4-294
OFBKKLGO_01838_yloB,TIGR01494,TIGR01494,"ATPase_P-type: HAD ATPase, P-type, family IC",TIGRFAM,15.0,83-177;429-575;210-346;601-721
OFBKKLGO_01838_yloB,TIGR01116,TIGR01116,"ATPase-IIA1_Ca: calcium-translocating P-type ATPase, SERCA-type",TIGRFAM,15.0,54-881
OFBKKLGO_01843_sumT,TIGR01469,TIGR01469,cobA_cysG_Cterm: uroporphyrinogen-III C-methyltransferase,TIGRFAM,15.0,2-238
OFBKKLGO_01844_cysC,TIGR00455,TIGR00455,apsK: adenylyl-sulfate kinase,TIGRFAM,15.0,8-191
OFBKKLGO_01847_cysH,TIGR02055,TIGR02055,"APS_reductase: adenylylsulfate reductase, thioredoxin dependent",TIGRFAM,15.0,43-231
OFBKKLGO_01847_cysH,TIGR00434,TIGR00434,cysH: phosophoadenylyl-sulfate reductase,TIGRFAM,15.0,24-233
OFBKKLGO_01849_pyrE,TIGR00336,TIGR00336,pyrE: orotate phosphoribosyltransferase,TIGRFAM,15.0,7-177
OFBKKLGO_01850_pyrF,TIGR01740,TIGR01740,pyrF: orotidine 5'-phosphate decarboxylase,TIGRFAM,15.0,6-231
OFBKKLGO_01851_pyrD,TIGR01037,TIGR01037,pyrD_sub1_fam: dihydroorotate dehydrogenase family protein,TIGRFAM,15.0,2-300
OFBKKLGO_01853_carB_2,TIGR01369,TIGR01369,"CPSaseII_lrg: carbamoyl-phosphate synthase, large subunit",TIGRFAM,15.0,2-1047
OFBKKLGO_01854_carA_2,TIGR01368,TIGR01368,"CPSaseIIsmall: carbamoyl-phosphate synthase, small subunit",TIGRFAM,15.0,4-351
OFBKKLGO_01855_pyrC,TIGR00857,TIGR00857,"pyrC_multi: dihydroorotase, multifunctional complex type",TIGRFAM,15.0,15-424
OFBKKLGO_01856_pyrB,TIGR00670,TIGR00670,asp_carb_tr: aspartate carbamoyltransferase,TIGRFAM,15.0,2-289
